{
  "schemaVersion": 1,
  "format": "embeddedknowledge-glossary-v1",
  "lessonId": "PREM-QNT-008",
  "lessonVersion": "0.2.0",
  "terms": [
    {
      "id": "term-hypotenuse",
      "term": "hypotenuse",
      "definition": "The side opposite the right angle in a right triangle; it is the triangle's longest side.",
      "aliases": [],
      "sceneIds": [
        "scene-orientation",
        "scene-concept",
        "scene-worked-example",
        "scene-practice",
        "scene-synthesis"
      ]
    },
    {
      "id": "term-radian",
      "term": "radian",
      "definition": "A plane-angle unit defined by arc length divided by radius; a full turn is 2 pi radians.",
      "aliases": [
        "rad"
      ],
      "sceneIds": [
        "scene-concept",
        "scene-worked-example",
        "scene-practice",
        "scene-transfer",
        "scene-synthesis"
      ]
    },
    {
      "id": "term-sine",
      "term": "sine",
      "definition": "For a right-triangle acute angle, opposite divided by hypotenuse; on the unit circle, the vertical coordinate.",
      "aliases": [
        "sin"
      ],
      "sceneIds": [
        "scene-concept",
        "scene-worked-example",
        "scene-misconception",
        "scene-transfer",
        "scene-synthesis"
      ]
    },
    {
      "id": "term-cosine",
      "term": "cosine",
      "definition": "For a right-triangle acute angle, adjacent divided by hypotenuse; on the unit circle, the horizontal coordinate.",
      "aliases": [
        "cos"
      ],
      "sceneIds": [
        "scene-concept",
        "scene-worked-example",
        "scene-practice",
        "scene-transfer",
        "scene-synthesis"
      ]
    },
    {
      "id": "term-tangent",
      "term": "tangent",
      "definition": "For a right-triangle acute angle, opposite divided by adjacent; equivalently sine divided by cosine where defined.",
      "aliases": [
        "tan"
      ],
      "sceneIds": [
        "scene-concept",
        "scene-worked-example",
        "scene-practice",
        "scene-transfer"
      ]
    },
    {
      "id": "term-inverse-trig",
      "term": "inverse trigonometric function",
      "definition": "A function such as arcsin, arccos, or arctan that returns a principal angle from a trigonometric ratio.",
      "aliases": [
        "arc function"
      ],
      "sceneIds": [
        "scene-concept",
        "scene-misconception",
        "scene-practice",
        "scene-transfer",
        "scene-synthesis"
      ]
    },
    {
      "id": "term-unit-circle",
      "term": "unit circle",
      "definition": "The circle centered at the origin with radius 1; a standard-position angle has endpoint coordinates (cosine, sine) on it.",
      "aliases": [],
      "sceneIds": [
        "scene-concept",
        "scene-worked-example",
        "scene-synthesis"
      ]
    },
    {
      "id": "term-reference-angle",
      "term": "reference angle",
      "definition": "The acute nonnegative angle between a terminal side and the horizontal axis, used with quadrant signs to interpret a standard-position direction.",
      "aliases": [],
      "sceneIds": [
        "scene-concept",
        "scene-synthesis"
      ]
    },
    {
      "id": "term-scale-factor",
      "term": "linear scale factor",
      "definition": "The multiplier applied to corresponding lengths; areas and volumes scale by its square and cube respectively.",
      "aliases": [
        "length scale"
      ],
      "sceneIds": [
        "scene-concept",
        "scene-practice",
        "scene-transfer",
        "scene-synthesis"
      ]
    }
  ]
}
