{
  "schemaVersion": 1,
  "format": "embeddedknowledge-glossary-v1",
  "lessonId": "PREM-LPP-001",
  "lessonVersion": "0.1.2",
  "terms": [
    {
      "id": "term-domain",
      "term": "domain",
      "definition": "A broad curricular region that contains graph modules and does not itself represent one atomic mastery outcome.",
      "aliases": ["curriculum domain"],
      "sceneIds": ["scene-concept", "scene-practice", "scene-retrieval", "scene-synthesis"]
    },
    {
      "id": "term-module",
      "term": "module",
      "definition": "A coherent graph-scale cluster of related topics inside a domain.",
      "aliases": ["graph module"],
      "sceneIds": ["scene-concept", "scene-practice", "scene-retrieval", "scene-synthesis"]
    },
    {
      "id": "term-topic",
      "term": "topic",
      "definition": "The atomic graph unit whose outcome can be tracked independently in a mastery record.",
      "aliases": ["topic node", "atomic outcome"],
      "sceneIds": ["scene-concept", "scene-worked-example", "scene-practice", "scene-retrieval", "scene-transfer", "scene-synthesis"]
    },
    {
      "id": "term-prerequisite",
      "term": "prerequisite",
      "definition": "An outcome that should normally be secure before a dependent outcome is attempted.",
      "aliases": ["dependency"],
      "sceneIds": ["scene-concept", "scene-worked-example", "scene-misconception", "scene-practice", "scene-retrieval", "scene-transfer", "scene-synthesis"]
    },
    {
      "id": "term-cross-link",
      "term": "cross-link",
      "definition": "A conceptual relationship between topics that does not by itself impose a study order.",
      "aliases": ["conceptual link"],
      "sceneIds": ["scene-concept", "scene-misconception", "scene-practice", "scene-retrieval", "scene-transfer", "scene-synthesis"]
    },
    {
      "id": "term-pathway",
      "term": "pathway",
      "definition": "In the pathway array, a route tag used with the published resolution rule to select a relevant topic set. Separately, pathway is also a permitted value of the requirement field; that value describes curricular placement and is not the route-tag array.",
      "aliases": ["route", "pathway array", "requirement: pathway"],
      "sceneIds": ["scene-concept", "scene-practice", "scene-transfer", "scene-synthesis"]
    },
    {
      "id": "term-core",
      "term": "core",
      "definition": "The Boolean field used by route resolution for common portable-core membership; in the current graph it is derived from requirement: portable-core.",
      "aliases": ["core field", "portable-core membership"],
      "sceneIds": ["scene-concept", "scene-practice", "scene-retrieval", "scene-transfer", "scene-synthesis"]
    },
    {
      "id": "term-evidence-confidence",
      "term": "evidence confidence",
      "definition": "The graph's confidence in a topic's curricular placement, not a probability that its scientific content is true.",
      "aliases": ["evidenceConfidence"],
      "sceneIds": ["scene-concept", "scene-misconception", "scene-practice", "scene-retrieval", "scene-transfer"]
    },
    {
      "id": "term-source-tag",
      "term": "source tag",
      "definition": "A key identifying an evidence family used to support curricular placement; it is not a route-membership rule.",
      "aliases": ["sourceTags"],
      "sceneIds": ["scene-concept", "scene-practice", "scene-transfer"]
    }
  ]
}
