{
  "schemaVersion": 1,
  "format": "embeddedknowledge-glossary-v1",
  "lessonId": "PREM-CHE-001",
  "lessonVersion": "0.0.0",
  "terms": [
    {
      "id": "term-conjugate-pair",
      "term": "conjugate acid–base pair",
      "definition": "Two species related by the gain or loss of one proton.",
      "aliases": ["conjugate pair"],
      "sceneIds": ["scene-concept", "scene-worked-example"]
    },
    {
      "id": "term-lewis-base",
      "term": "Lewis base",
      "definition": "An electron-pair donor in the Lewis acid–base model.",
      "aliases": [],
      "sceneIds": ["scene-concept", "scene-practice"]
    }
  ]
}
