{
  "schemaVersion": 1,
  "format": "embeddedknowledge-glossary-v1",
  "lessonId": "PREM-SCI-006",
  "lessonVersion": "0.2.0",
  "terms": [
    {
      "id": "term-target-quantity",
      "term": "target quantity",
      "definition": "The quantity that a measurement is intended to estimate, such as the duration of a specified event.",
      "aliases": [
        "quantity of interest"
      ],
      "sceneIds": [
        "scene-four-question-audit",
        "scene-defend-judgment"
      ]
    },
    {
      "id": "term-construct",
      "term": "construct",
      "definition": "An idea used to organize related observations, such as alertness or coordination, that is represented through chosen indicators rather than observed directly as a single reading.",
      "aliases": [
        "target construct"
      ],
      "sceneIds": [
        "scene-four-question-audit",
        "scene-worked-alertness-audit",
        "scene-practise-and-repair",
        "scene-transfer-team-coordination",
        "scene-defend-judgment"
      ]
    },
    {
      "id": "term-operational-definition",
      "term": "operational definition",
      "definition": "A specified procedure or rule that turns a target quantity or construct into an observable record.",
      "aliases": [
        "measurement operation"
      ],
      "sceneIds": [
        "scene-when-numbers-agree",
        "scene-four-question-audit",
        "scene-worked-alertness-audit",
        "scene-practise-and-repair",
        "scene-transfer-team-coordination",
        "scene-defend-judgment"
      ]
    },
    {
      "id": "term-measurement-error",
      "term": "measurement error",
      "definition": "The difference between a measured value and an appropriate reference quantity value; it can be described as having random and systematic components in a stated measurement model.",
      "aliases": [],
      "sceneIds": [
        "scene-when-numbers-agree",
        "scene-four-question-audit",
        "scene-worked-alertness-audit",
        "scene-practise-and-repair",
        "scene-transfer-team-coordination",
        "scene-defend-judgment"
      ]
    },
    {
      "id": "term-random-measurement-error",
      "term": "random measurement error",
      "definition": "The component of measurement error that varies unpredictably across replicate measurements under stated conditions and appears as dispersion among results.",
      "aliases": [
        "random error component"
      ],
      "sceneIds": [
        "scene-when-numbers-agree",
        "scene-four-question-audit",
        "scene-worked-alertness-audit",
        "scene-practise-and-repair"
      ]
    },
    {
      "id": "term-systematic-measurement-error",
      "term": "systematic measurement error",
      "definition": "The component of measurement error that remains constant or varies predictably across replicate measurements and appears as a shared shift or pattern relative to an appropriate reference.",
      "aliases": [
        "systematic error component",
        "measurement bias"
      ],
      "sceneIds": [
        "scene-when-numbers-agree",
        "scene-four-question-audit",
        "scene-worked-alertness-audit",
        "scene-practise-and-repair",
        "scene-transfer-team-coordination",
        "scene-defend-judgment"
      ]
    },
    {
      "id": "term-measurement-precision",
      "term": "measurement precision",
      "definition": "How closely replicate measured values agree when obtained under specified conditions; precision describes dispersion and does not by itself establish closeness to a reference.",
      "aliases": [
        "precision"
      ],
      "sceneIds": [
        "scene-four-question-audit",
        "scene-worked-alertness-audit",
        "scene-practise-and-repair"
      ]
    },
    {
      "id": "term-repeatability",
      "term": "repeatability",
      "definition": "Measurement precision when specified conditions are kept the same, commonly including the procedure, operator, measuring system, location, and a short time interval.",
      "aliases": [
        "measurement repeatability"
      ],
      "sceneIds": [
        "scene-when-numbers-agree",
        "scene-four-question-audit",
        "scene-worked-alertness-audit",
        "scene-practise-and-repair",
        "scene-transfer-team-coordination",
        "scene-defend-judgment"
      ]
    },
    {
      "id": "term-reproducibility",
      "term": "reproducibility",
      "definition": "Measurement precision when specified conditions change; a useful reproducibility claim names the changed conditions, such as operator, instrument, laboratory, or day.",
      "aliases": [
        "measurement reproducibility"
      ],
      "sceneIds": [
        "scene-when-numbers-agree",
        "scene-four-question-audit",
        "scene-worked-alertness-audit",
        "scene-practise-and-repair",
        "scene-transfer-team-coordination",
        "scene-defend-judgment"
      ]
    },
    {
      "id": "term-calibration",
      "term": "calibration",
      "definition": "An operation that establishes a relation, under specified conditions, between indications and values supplied by measurement standards with associated uncertainties, then uses that relation to obtain a measurement result.",
      "aliases": [],
      "sceneIds": [
        "scene-four-question-audit",
        "scene-worked-alertness-audit",
        "scene-practise-and-repair",
        "scene-transfer-team-coordination",
        "scene-defend-judgment"
      ]
    },
    {
      "id": "term-metrological-traceability",
      "term": "metrological traceability",
      "definition": "A property of a measurement result that relates it to a stated reference through a documented, unbroken calibration chain in which each link contributes to measurement uncertainty.",
      "aliases": [
        "traceability"
      ],
      "sceneIds": [
        "scene-four-question-audit",
        "scene-worked-alertness-audit",
        "scene-defend-judgment"
      ]
    },
    {
      "id": "term-measurement-accuracy",
      "term": "measurement accuracy",
      "definition": "Closeness of agreement between a measured value and the value of the quantity being measured; accuracy is a qualitative concept and is not the same as precision.",
      "aliases": [
        "accuracy"
      ],
      "sceneIds": [
        "scene-four-question-audit"
      ]
    },
    {
      "id": "term-reliability",
      "term": "reliability",
      "definition": "Consistency of scores or measurements across specified replications, such as occasions, raters, or item samples; its interpretation depends on which sources of variation are included.",
      "aliases": [
        "measurement reliability"
      ],
      "sceneIds": [
        "scene-when-numbers-agree",
        "scene-four-question-audit"
      ]
    },
    {
      "id": "term-construct-validity",
      "term": "construct validity",
      "definition": "The degree to which evidence and theory support the proposed interpretation of measurement results for a stated use, including how well the operation represents the intended construct and excludes irrelevant influences.",
      "aliases": [
        "validity argument"
      ],
      "sceneIds": [
        "scene-when-numbers-agree",
        "scene-four-question-audit",
        "scene-worked-alertness-audit",
        "scene-practise-and-repair",
        "scene-transfer-team-coordination",
        "scene-defend-judgment"
      ]
    },
    {
      "id": "term-convergent-evidence",
      "term": "convergent evidence",
      "definition": "Evidence from a predicted relationship between a measure and another defensible measure of the same or a closely related construct.",
      "aliases": [],
      "sceneIds": [
        "scene-four-question-audit",
        "scene-worked-alertness-audit"
      ]
    },
    {
      "id": "term-discriminant-evidence",
      "term": "discriminant evidence",
      "definition": "Evidence from a predicted weak or distinct relationship between a measure and measures of different constructs.",
      "aliases": [],
      "sceneIds": [
        "scene-four-question-audit",
        "scene-worked-alertness-audit"
      ]
    },
    {
      "id": "term-inter-rater-agreement",
      "term": "inter-rater agreement",
      "definition": "The degree to which independent raters give the same ratings or classifications to the same cases under a stated coding rule and conditions.",
      "aliases": [
        "inter-observer agreement"
      ],
      "sceneIds": [
        "scene-four-question-audit",
        "scene-practise-and-repair",
        "scene-transfer-team-coordination"
      ]
    },
    {
      "id": "term-construct-underrepresentation",
      "term": "construct underrepresentation",
      "definition": "A validity problem in which the measurement operation leaves out important parts of the intended construct.",
      "aliases": [],
      "sceneIds": [
        "scene-practise-and-repair",
        "scene-transfer-team-coordination"
      ]
    },
    {
      "id": "term-construct-irrelevant-influence",
      "term": "construct-irrelevant influence",
      "definition": "A feature outside the intended construct that changes measurement results and can therefore distort the proposed interpretation.",
      "aliases": [
        "construct-irrelevant variance"
      ],
      "sceneIds": [
        "scene-four-question-audit",
        "scene-worked-alertness-audit",
        "scene-practise-and-repair",
        "scene-transfer-team-coordination"
      ]
    }
  ]
}
