{
  "schemaVersion": 1,
  "format": "embeddedknowledge-glossary-v1",
  "lessonId": "PREM-SCI-011",
  "lessonVersion": "0.2.0",
  "terms": [
    {
      "id": "term-evidence-line",
      "term": "evidence line",
      "definition": "One coherent group of observations or studies that contributes a particular kind of support to a specified scientific question.",
      "aliases": [
        "line of evidence"
      ],
      "sceneIds": [
        "scene-orientation",
        "scene-concept",
        "scene-worked-example",
        "scene-misconception",
        "scene-practice",
        "scene-transfer",
        "scene-synthesis"
      ]
    },
    {
      "id": "term-molecular-evidence",
      "term": "molecular evidence",
      "definition": "Evidence about molecular identity, structure, interaction, reaction, or change that can test one or more links in a proposed mechanism.",
      "aliases": [],
      "sceneIds": [
        "scene-orientation",
        "scene-concept",
        "scene-worked-example",
        "scene-misconception",
        "scene-practice",
        "scene-transfer"
      ]
    },
    {
      "id": "term-organismal-evidence",
      "term": "organismal evidence",
      "definition": "Evidence about a response or phenotype in an intact organism, where many tissues, processes, behaviours, and environmental inputs can interact.",
      "aliases": [
        "whole-organism evidence"
      ],
      "sceneIds": [
        "scene-orientation",
        "scene-concept",
        "scene-worked-example",
        "scene-misconception",
        "scene-practice",
        "scene-transfer",
        "scene-synthesis"
      ]
    },
    {
      "id": "term-population-evidence",
      "term": "population evidence",
      "definition": "Evidence about patterns, variation, associations, or effects across a defined group of people or other organisms, settings, or times.",
      "aliases": [],
      "sceneIds": [
        "scene-orientation",
        "scene-concept",
        "scene-worked-example",
        "scene-practice",
        "scene-transfer",
        "scene-synthesis"
      ]
    },
    {
      "id": "term-intervention-evidence",
      "term": "intervention evidence",
      "definition": "Evidence from a design in which an investigator deliberately assigns or changes an exposure, treatment, process, or condition and compares outcomes.",
      "aliases": [
        "experimental intervention evidence"
      ],
      "sceneIds": [
        "scene-orientation",
        "scene-concept",
        "scene-worked-example",
        "scene-misconception",
        "scene-practice",
        "scene-transfer",
        "scene-synthesis"
      ]
    },
    {
      "id": "term-mechanistic-evidence",
      "term": "mechanistic evidence",
      "definition": "Evidence that bears on the entities, interactions, sequence, and constraints proposed to produce an outcome.",
      "aliases": [],
      "sceneIds": [
        "scene-concept",
        "scene-worked-example",
        "scene-misconception",
        "scene-practice",
        "scene-transfer",
        "scene-synthesis"
      ]
    },
    {
      "id": "term-reliability",
      "term": "reliability",
      "definition": "The extent to which the information in a piece or line of evidence is credible for what it reports, given its design, measurement, conduct, analysis, and reporting.",
      "aliases": [],
      "sceneIds": [
        "scene-concept",
        "scene-worked-example",
        "scene-practice",
        "scene-transfer",
        "scene-synthesis"
      ],
      "alignment": {
        "priorLesson": "PREM-SCI-006",
        "relation": "distinct-sense",
        "note": "Lesson 6 defines reliability as the consistency of a measurement across repeated readings. Here reliability is the broader evidence-appraisal sense: the credibility of a whole line of evidence. A measurement can be reliable in the Lesson 6 sense yet sit inside evidence judged not credible here."
      }
    },
    {
      "id": "term-relevance",
      "term": "relevance",
      "definition": "The contribution reliable evidence would make to the specified question, considering the match in exposure, outcome, system, population, dose, and timing.",
      "aliases": [],
      "sceneIds": [
        "scene-concept",
        "scene-worked-example",
        "scene-practice",
        "scene-transfer",
        "scene-synthesis"
      ]
    },
    {
      "id": "term-consistency",
      "term": "consistency",
      "definition": "The extent to which contributions from different pieces or lines of evidence are compatible for the specified question after differences in design and scope are considered.",
      "aliases": [],
      "sceneIds": [
        "scene-concept",
        "scene-worked-example",
        "scene-transfer",
        "scene-synthesis"
      ]
    },
    {
      "id": "term-independent-bias",
      "term": "independent bias structure",
      "definition": "A pattern in which the main potential errors of one approach differ from and are not caused by the main potential errors of another approach.",
      "aliases": [
        "differing key sources of bias"
      ],
      "sceneIds": [
        "scene-concept",
        "scene-worked-example",
        "scene-misconception",
        "scene-practice",
        "scene-synthesis"
      ]
    },
    {
      "id": "term-calibrated-claim",
      "term": "calibrated claim",
      "definition": "A conclusion whose causal language, strength, scope, and certainty are limited to what the integrated evidence warrants.",
      "aliases": [
        "calibrated conclusion"
      ],
      "sceneIds": [
        "scene-orientation",
        "scene-concept",
        "scene-worked-example",
        "scene-practice",
        "scene-transfer",
        "scene-synthesis"
      ]
    },
    {
      "id": "term-pivotal-evidence",
      "term": "pivotal evidence",
      "definition": "The evidence line or result that carries the greatest justified influence on the integrated conclusion for the specified question.",
      "aliases": [],
      "sceneIds": [
        "scene-concept",
        "scene-worked-example",
        "scene-practice",
        "scene-transfer",
        "scene-synthesis"
      ]
    },
    {
      "id": "term-confounding",
      "term": "confounding",
      "definition": "Distortion of an exposure-outcome comparison by another factor related to both the exposure and the outcome, such that the observed association does not isolate the exposure's effect.",
      "aliases": [
        "confounder"
      ],
      "sceneIds": [
        "scene-orientation",
        "scene-concept",
        "scene-worked-example",
        "scene-practice",
        "scene-transfer",
        "scene-synthesis"
      ]
    },
    {
      "id": "term-randomization",
      "term": "randomization",
      "definition": "Assignment by a chance process that gives each eligible unit a defined allocation possibility and tends to balance prognostic factors between comparison groups.",
      "aliases": [
        "random assignment"
      ],
      "sceneIds": [
        "scene-concept",
        "scene-worked-example",
        "scene-misconception",
        "scene-practice",
        "scene-transfer",
        "scene-synthesis"
      ]
    }
  ]
}
