{
  "schemaVersion": 1,
  "format": "embeddedknowledge-glossary-v1",
  "lessonId": "PREM-STA-008",
  "lessonVersion": "0.1.0",
  "terms": [
    {
      "id": "term-null-hypothesis",
      "term": "null hypothesis",
      "definition": "A statement fixing the quantity under study at one specified value, adopted so that a model can predict what data should look like if it held. In this lesson it sets the true difference in mean fasting glucose between the late and early dinner groups at 0 mg/dL. It is adopted as a starting assumption for calculation and carries no suggestion that anyone believes it.",
      "aliases": [
        "H0",
        "test hypothesis",
        "null"
      ],
      "sceneIds": [
        "scene-assuming-the-thing-you-doubt",
        "scene-nine-milligrams",
        "scene-nouns-that-go-wrong",
        "scene-line-and-word",
        "scene-practice",
        "scene-different-clothes",
        "scene-mastery-check",
        "scene-clinical-wrap-up"
      ],
      "alignment": {
        "priorLesson": "PREM-SCI-002",
        "relation": "narrow",
        "note": "PREM-SCI-002 defines a hypothesis as a proposed explanation or relationship from which observable expectations can be derived. A null hypothesis is one of those, narrowed in two ways: it must fix a numerical quantity at a single stated value, and it is adopted for the purpose of being tested against rather than because it is the explanation on offer. The scientific hypothesis in the dinner-timing study is that later dinners raise fasting glucose; the null hypothesis is its numerical foil, and scene 2 bridges the two senses where the word first appears in the new sense."
      }
    },
    {
      "id": "term-alternative-hypothesis",
      "term": "alternative hypothesis",
      "definition": "The statement covering the values the null hypothesis excludes. A two-sided alternative allows the quantity to differ from the null value in either direction, which is the form used throughout this lesson; a one-sided alternative allows departure in one direction only and counts the other direction as no evidence at all.",
      "aliases": [
        "H1",
        "two-sided alternative"
      ],
      "sceneIds": [
        "scene-assuming-the-thing-you-doubt",
        "scene-nine-milligrams",
        "scene-practice",
        "scene-mastery-check"
      ],
      "alignment": {
        "priorLesson": "PREM-SCI-002",
        "relation": "narrow",
        "note": "Narrows PREM-SCI-002's general sense of a hypothesis to the specific complementary statement paired with a null in a statistical test. It is defined by what the null leaves out rather than by an explanatory account of its own, so it is a weaker object than the scientific hypothesis PREM-SCI-002 teaches."
      }
    },
    {
      "id": "term-statistical-model",
      "term": "statistical model",
      "definition": "The full set of assumptions needed to turn a hypothesis into a prediction about data. For the dinner-timing comparison it holds the null value, the treatment of participants as independent contributors, the within-group spread of 16 mg/dL, the shape of the reference curve, and the assumption that the analysis reported was the analysis planned. Every probability in this lesson is computed inside this set, so it inherits every fault the set contains.",
      "aliases": [
        "the model",
        "model assumptions"
      ],
      "sceneIds": [
        "scene-assuming-the-thing-you-doubt",
        "scene-nine-milligrams",
        "scene-nouns-that-go-wrong",
        "scene-clinical-wrap-up"
      ],
      "alignment": {
        "priorLesson": "PREM-SCI-010",
        "relation": "narrow",
        "note": "PREM-SCI-010 defines a scientific model as a selective representation of a system built to answer a stated question, and PREM-SCI-010's term-model-assumption as a simplification accepted so the model can represent selected relationships. This lesson narrows both to the statistical case: the representation is of how data would be generated under a stated hypothesis, and its assumptions are the specific conditions a test's probability calculation relies on. The narrower sense does not replace the broader one, and the assumptions here are model assumptions in exactly PREM-SCI-010's sense."
      }
    },
    {
      "id": "term-test-statistic",
      "term": "test statistic",
      "definition": "A number computed from the data to measure how far the observation sits from what the model predicts, built so that it grows as the data depart from the hypothesis. In this lesson it is the observed difference minus the null value, divided by the standard error, which expresses the gap in standard errors and so removes the original units. The two-mean worked examples label it z because they use a declared normal approximation; another procedure may use a different reference curve and label.",
      "aliases": [
        "t statistic",
        "z statistic"
      ],
      "sceneIds": [
        "scene-nine-milligrams",
        "scene-practice",
        "scene-different-clothes",
        "scene-mastery-check"
      ]
    },
    {
      "id": "term-null-distribution",
      "term": "null distribution",
      "definition": "The distribution of results the null model predicts across repeats of the study. For the dinner-timing difference this lesson uses a normal approximation centred on 0 mg/dL with an estimated standard error of 4.13 mg/dL. A p-value is an area measured on the selected distribution, which is why the shape of the curve is itself a modelling assumption.",
      "aliases": [
        "distribution under the null",
        "reference distribution"
      ],
      "sceneIds": [
        "scene-nine-milligrams",
        "scene-nouns-that-go-wrong",
        "scene-line-and-word"
      ]
    },
    {
      "id": "term-p-value",
      "term": "p-value",
      "definition": "The probability, computed on the assumption that the null hypothesis and every other assumption in the statistical model are correct, that the test statistic would be at least as extreme as the value actually observed. For the dinner-timing study the two-sided normal-approximation value is 0.029. It is a statement about data made under an assumption about the world, and it reports neither the probability that the null is true, nor the probability that chance produced the result, nor the size of any effect.",
      "aliases": [
        "p",
        "observed significance level"
      ],
      "sceneIds": [
        "scene-one-number-five-readings",
        "scene-assuming-the-thing-you-doubt",
        "scene-nine-milligrams",
        "scene-nouns-that-go-wrong",
        "scene-line-and-word",
        "scene-practice",
        "scene-different-clothes",
        "scene-mastery-check",
        "scene-clinical-wrap-up"
      ]
    },
    {
      "id": "term-significance-level",
      "term": "significance level",
      "definition": "A probability chosen before the data are seen, setting how far into the tail of the null distribution a result must fall before the analysis calls the data incompatible with the null. It belongs to the study's design and is conventionally 0.05. It is compared with the p-value and is a separate quantity from it, since one is fixed in advance and the other is measured afterwards.",
      "aliases": [
        "alpha",
        "cut-off"
      ],
      "sceneIds": [
        "scene-line-and-word",
        "scene-practice",
        "scene-mastery-check"
      ]
    },
    {
      "id": "term-statistically-significant",
      "term": "statistically significant",
      "definition": "A label applied to a test result whose p-value falls at or below the significance level chosen in advance. It records where one number landed relative to a threshold. In this technical sense the word carries no information about how large an effect is, how important it is, or whether anyone should act on it, which separates it sharply from the everyday sense of significant meaning sizeable or worth attention.",
      "aliases": [
        "statistical significance",
        "significant at the 0.05 level"
      ],
      "sceneIds": [
        "scene-line-and-word",
        "scene-practice",
        "scene-different-clothes",
        "scene-mastery-check",
        "scene-clinical-wrap-up"
      ]
    },
    {
      "id": "term-confusion-of-the-inverse",
      "term": "confusion of the inverse",
      "definition": "The reasoning error of treating the probability of A given B as though it were the probability of B given A. Applied to a test result it turns a probability computed under a hypothesis into a probability of that hypothesis, so that p = 0.029 is misread as a 2.9 per cent chance the null is true or a 97.1 per cent chance the effect is real.",
      "aliases": [
        "inverted conditional",
        "transposed conditional"
      ],
      "sceneIds": [
        "scene-nouns-that-go-wrong",
        "scene-practice",
        "scene-different-clothes",
        "scene-mastery-check",
        "scene-clinical-wrap-up"
      ],
      "alignment": {
        "priorLesson": "PREM-STA-004",
        "relation": "adopt",
        "note": "Adopts PREM-STA-004's meaning without change: treating P(A given B) as though it were P(B given A). That lesson established the error with screening tables, where the same test gave 0.269 in one clinic and 0.818 in another while its detection rate stayed fixed. This lesson applies the identical error to a p-value, which is the case PREM-STA-004 explicitly forwarded here, and adds no new sense of the term."
      }
    }
  ]
}
