{"schemaVersion":1,"format":"embeddedknowledge-glossary-v1","lessonId":"PREM-QNT-006","lessonVersion":"0.2.0","terms":[
{"id":"term-logarithm","term":"logarithm","definition":"The exponent to which a valid base must be raised to produce a positive argument.","aliases":["log"],"sceneIds":["scene-orientation","scene-concept","scene-worked-example","scene-misconception","scene-practice","scene-transfer","scene-synthesis"]},
{"id":"term-natural-logarithm","term":"natural logarithm","definition":"The logarithm with base e, written ln.","aliases":["ln"],"sceneIds":["scene-concept","scene-worked-example","scene-practice","scene-transfer"]},
{"id":"term-common-logarithm","term":"common logarithm","definition":"The base-10 logarithm, written log in this lesson when the base is otherwise clear.","aliases":["base-10 logarithm"],"sceneIds":["scene-concept","scene-misconception"]},
{"id":"term-growth-factor","term":"growth factor","definition":"A per-interval multiplier greater than one in a discrete exponential model.","aliases":["multiplicative growth factor"],"sceneIds":["scene-orientation","scene-concept","scene-worked-example","scene-practice","scene-synthesis"]},
{"id":"term-decay-factor","term":"decay factor","definition":"A positive per-interval multiplier below one in a discrete exponential model.","aliases":["retention factor"],"sceneIds":["scene-concept","scene-practice","scene-transfer"]},
{"id":"term-half-life","term":"half-life","definition":"The positive time required by an exponential decay model for a quantity to become one half of its reference value.","aliases":["halving time"],"sceneIds":["scene-transfer","scene-synthesis"]},
{"id":"term-dimensionless-ratio","term":"dimensionless ratio","definition":"A quotient of compatible like quantities whose units cancel, leaving a pure number suitable as a logarithm argument.","aliases":["quantity ratio"],"sceneIds":["scene-concept","scene-worked-example","scene-transfer","scene-synthesis"]}]}
