{
  "schemaVersion": 1,
  "format": "embeddedknowledge-glossary-v1",
  "lessonId": "PREM-QNT-002",
  "lessonVersion": "0.2.0",
  "terms": [
    {
      "id": "term-quantity",
      "term": "quantity",
      "definition": "A measurable or specified property whose value can be expressed as a numerical value multiplied by a unit.",
      "aliases": [
        "physical quantity"
      ],
      "sceneIds": [
        "scene-orientation",
        "scene-concept",
        "scene-worked-example",
        "scene-transfer",
        "scene-synthesis",
        "scene-clinical-wrap-up"
      ]
    },
    {
      "id": "term-numerical-value",
      "term": "numerical value",
      "definition": "The number multiplying a unit when a quantity is expressed in that unit.",
      "aliases": [
        "magnitude in a stated unit"
      ],
      "sceneIds": [
        "scene-concept",
        "scene-synthesis"
      ]
    },
    {
      "id": "term-conversion-factor",
      "term": "conversion factor",
      "definition": "A ratio of equal quantities used as a multiplicative factor of one to change unit representation without changing the quantity.",
      "aliases": [
        "unit factor"
      ],
      "sceneIds": [
        "scene-concept",
        "scene-worked-example",
        "scene-misconception",
        "scene-practice",
        "scene-transfer",
        "scene-synthesis",
        "scene-clinical-wrap-up"
      ]
    },
    {
      "id": "term-dimension",
      "term": "dimension",
      "definition": "A description of a quantity type in terms of base quantity types such as length, time, and mass, independent of a particular unit.",
      "aliases": [
        "physical dimension"
      ],
      "sceneIds": [
        "scene-concept",
        "scene-worked-example",
        "scene-practice",
        "scene-synthesis",
        "scene-clinical-wrap-up"
      ]
    },
    {
      "id": "term-dimensional-consistency",
      "term": "dimensional consistency",
      "definition": "The requirement that quantities added or equated have compatible dimensions; satisfying it is necessary but does not prove a model is correct.",
      "aliases": [
        "dimensional homogeneity"
      ],
      "sceneIds": [
        "scene-concept",
        "scene-practice",
        "scene-synthesis"
      ]
    },
    {
      "id": "term-compound-unit",
      "term": "compound unit",
      "definition": "A unit formed by multiplying, dividing, or exponentiating other units, such as metres per second or square centimetres.",
      "aliases": [
        "derived unit expression"
      ],
      "sceneIds": [
        "scene-orientation",
        "scene-concept",
        "scene-misconception",
        "scene-practice",
        "scene-transfer"
      ]
    }
  ]
}
