{
  "schemaVersion": 1,
  "format": "embeddedknowledge-glossary-v1",
  "lessonId": "PREM-LPP-003",
  "lessonVersion": "0.1.2",
  "terms": [
    {
      "id": "term-mastery",
      "term": "mastery",
      "definition": "In this lesson, a provisional judgment supported by a pattern of successful unaided performance after delay and variation under declared conditions; it is not a universal threshold or a professional credential.",
      "aliases": [
        "durable mastery"
      ],
      "sceneIds": [
        "scene-orientation",
        "scene-concept",
        "scene-misconception",
        "scene-assessment",
        "scene-synthesis"
      ]
    },
    {
      "id": "term-durable-performance",
      "term": "durable performance",
      "definition": "Observable reconstruction or use of knowledge after a meaningful delay, under stated conditions, rather than only during the original study encounter.",
      "aliases": [],
      "sceneIds": [
        "scene-orientation",
        "scene-concept",
        "scene-worked-example",
        "scene-assessment"
      ]
    },
    {
      "id": "term-familiarity",
      "term": "familiarity",
      "definition": "A subjective sense that material is recognizable or easy while it is present; by itself, it does not show that the learner can reconstruct or use the material later.",
      "aliases": [
        "study fluency"
      ],
      "sceneIds": [
        "scene-orientation",
        "scene-concept",
        "scene-misconception",
        "scene-practice"
      ]
    },
    {
      "id": "term-retrieval-practice",
      "term": "retrieval practice",
      "definition": "An attempt to generate a relevant answer, explanation, prediction, representation, or procedure from memory before consulting the answer source.",
      "aliases": [
        "retrieval"
      ],
      "sceneIds": [
        "scene-concept",
        "scene-worked-example",
        "scene-retrieval-check",
        "scene-practice",
        "scene-transfer",
        "scene-synthesis"
      ]
    },
    {
      "id": "term-spacing",
      "term": "spacing",
      "definition": "Distributing learning or retrieval opportunities across time instead of placing all opportunities in one uninterrupted session.",
      "aliases": [
        "distributed practice"
      ],
      "sceneIds": [
        "scene-concept",
        "scene-worked-example",
        "scene-practice",
        "scene-transfer",
        "scene-synthesis"
      ]
    },
    {
      "id": "term-retention-horizon",
      "term": "retention horizon",
      "definition": "The future period over which the learner needs to retain and use the target knowledge, used here to constrain a retrieval plan.",
      "aliases": [
        "retention interval"
      ],
      "sceneIds": [
        "scene-concept",
        "scene-worked-example",
        "scene-practice",
        "scene-transfer"
      ]
    },
    {
      "id": "term-feedback",
      "term": "feedback",
      "definition": "Information after an attempt that identifies what was correct or incorrect, explains the relevant principle or process, and directs a useful next action.",
      "aliases": [
        "corrective feedback"
      ],
      "sceneIds": [
        "scene-concept",
        "scene-worked-example",
        "scene-retrieval-check",
        "scene-misconception",
        "scene-practice"
      ]
    },
    {
      "id": "term-interleaving",
      "term": "interleaving",
      "definition": "Mixing already introduced categories or strategies so that the learner must select and discriminate among them rather than repeat one type in a block.",
      "aliases": [
        "mixed practice"
      ],
      "sceneIds": [
        "scene-concept",
        "scene-practice",
        "scene-transfer",
        "scene-synthesis"
      ]
    },
    {
      "id": "term-decision-rule",
      "term": "decision rule",
      "definition": "A predeclared link between observed performance and the next planning action, such as adding support after a missing relation or extending a gap after successful delayed performance.",
      "aliases": [],
      "sceneIds": [
        "scene-concept",
        "scene-worked-example",
        "scene-practice",
        "scene-transfer"
      ]
    }
  ]
}
