{
  "schemaVersion": 1,
  "format": "embeddedknowledge-glossary-v1",
  "lessonId": "PREM-STA-012",
  "lessonVersion": "0.1.0",
  "terms": [
    {
      "id": "term-statistical-significance",
      "term": "statistical significance",
      "definition": "The property of a test result whose p-value falls at or below a cut-off chosen in advance. The p-value measures how compatible the data are with one specified statistical model, so the label records where a number computed from the data landed relative to a line drawn beforehand. It reports nothing about how large the effect is, nothing about whether the effect would change a decision, and nothing about who would benefit.",
      "aliases": [
        "statistically significant",
        "significant at the 0.05 level"
      ],
      "sceneIds": [
        "scene-two-readings",
        "scene-one-word-two-jobs",
        "scene-choose-the-number",
        "scene-where-the-interval-sits",
        "scene-practice",
        "scene-transfer",
        "scene-mastery-check",
        "scene-clinical-wrap-up"
      ],
      "alignment": {
        "priorLesson": "PREM-STA-008",
        "relation": "extend",
        "note": "PREM-STA-008 introduced the label and its arithmetic. This lesson keeps that meaning exactly and extends it with the disambiguation the learner needs: in ordinary English significant means large enough to matter, and the technical phrase carries no such content. Scene 2 bridges the two senses where the everyday word first appears, and names the second question practical significance so it can be asked separately."
      }
    },
    {
      "id": "term-practical-significance",
      "term": "practical significance",
      "definition": "The property of an effect that is large enough to change a decision someone is actually facing. Judging it requires the effect estimate in the units of the decision, a threshold saying how much would be enough, and a view of what acting would cost. Only the first of those comes out of a statistical analysis, so this judgement is made by people and not returned by a test.",
      "aliases": [
        "clinical significance",
        "clinical importance",
        "practical importance"
      ],
      "sceneIds": [
        "scene-one-word-two-jobs",
        "scene-clinical-wrap-up"
      ]
    },
    {
      "id": "term-minimal-clinically-important-difference",
      "term": "minimal clinically important difference",
      "definition": "The smallest change in an outcome measure that patients perceive as beneficial. It belongs to the outcome, the population and the people judging, and it takes different values in different populations and at different baseline severities. Nothing in a study's own data determines it, and a threshold lifted from a paper about a different population needs a clinical argument before it can be reused.",
      "aliases": [
        "MCID",
        "minimal important difference",
        "minimum clinically important difference"
      ],
      "sceneIds": [
        "scene-two-readings",
        "scene-choose-the-number",
        "scene-where-the-interval-sits",
        "scene-transfer",
        "scene-mastery-check",
        "scene-clinical-wrap-up"
      ]
    },
    {
      "id": "term-importance-threshold",
      "term": "importance threshold",
      "definition": "The value an effect must reach before a particular group would act on it, written on the same axis and in the same units as the effect estimate. It is an input to the reading of a result, supplied by the people accountable for the decision, and it may be an estimated minimal clinically important difference or a figure a service has justified on its own grounds. Stated openly it can be argued with; left implicit it governs the conclusion anyway.",
      "aliases": [
        "decision threshold",
        "threshold of importance"
      ],
      "sceneIds": [
        "scene-choose-the-number",
        "scene-where-the-interval-sits",
        "scene-practice",
        "scene-transfer",
        "scene-mastery-check",
        "scene-clinical-wrap-up"
      ]
    },
    {
      "id": "term-anchor-based-method",
      "term": "anchor-based method",
      "definition": "A way of estimating an importance threshold by comparing change on an outcome measure against an external standard, the anchor, which is usually something the patient reports and considers meaningful. The anchor supplies the judgement about what counts as beneficial and the measure supplies the scale.",
      "aliases": [
        "anchor-based approach"
      ],
      "sceneIds": [
        "scene-choose-the-number",
        "scene-mastery-check"
      ]
    },
    {
      "id": "term-distribution-based-method",
      "term": "distribution-based method",
      "definition": "A way of estimating an importance threshold from the statistical characteristics of scores within a sample, such as the standard deviation of change or the measurement error of the instrument. It answers a question about detectability, how large a change must be to stand clear of noise, which is related to but separate from whether a change matters to the person who has it.",
      "aliases": [
        "distribution-based approach"
      ],
      "sceneIds": [
        "scene-choose-the-number",
        "scene-mastery-check"
      ]
    },
    {
      "id": "term-effect-size",
      "term": "effect size",
      "definition": "The magnitude of an estimated effect, reported in the units of the outcome, such as 9.0 mg/dL of fasting glucose or 2.0 percentage points of screening attendance. It is the quantity a threshold comparison is made against, and it is the part of a result that a p-value cannot be decomposed back into.",
      "aliases": [
        "size of the effect",
        "magnitude of the effect"
      ],
      "sceneIds": [
        "scene-one-word-two-jobs",
        "scene-practice"
      ]
    },
    {
      "id": "term-bias",
      "term": "bias",
      "definition": "A systematic distortion of a study estimate or conclusion introduced through design, conduct, measurement, analysis, or reporting. It moves every repeat of a study the same way, so it displaces a confidence interval bodily instead of widening it, and a threshold comparison carried out on a displaced interval returns a confident answer to the wrong question.",
      "aliases": [
        "systematic error"
      ],
      "sceneIds": [
        "scene-mastery-check",
        "scene-clinical-wrap-up"
      ],
      "alignment": {
        "priorLesson": "PREM-SCI-008",
        "relation": "adopt",
        "note": "PREM-SCI-008 owns this term and its meaning is kept unchanged here, including the list of routes by which the distortion enters. This lesson adds no new sense and only draws out one consequence that matters for threshold reasoning: bias shifts an interval rather than widening it, so the arithmetic of a threshold comparison gives no warning when the estimate at its centre is displaced."
      }
    }
  ]
}
